"species","nbrood","avgbrood","minbrood","maxbrood","pmult","avgsire","minsire","maxsire","Reference"
"Common swift, Apus apus",42,2.0952380952381,NA,NA,0.0952380952380952,1.0952380952381,1,2,"Martins et al. 2002"
"Brown thornbill, Acanthiza pusilla",67,2.65671641791045,2,4,0.104477611940299,1.1044776119403,1,2,"Green et al. 2002"
"Great reed warbler, Acrocephalus arundinaceus",48,4.04166666666667,NA,NA,0.0208333333333333,1.02083333333333,1,2,"Leisler et al (2000)"
"Great reed warbler, Acrocephalus arundinaceus",162,4.18518518518519,NA,NA,0.0617283950617284,1.06172839506173,1,2,"Hasselquist et al. (1996)"
"Sedge warbler, Acrocephalus schoenobaenus",44,4.56818181818182,4,6,0.204545454545455,1.22727272727273,1,3,"Langefors et al. 1998"
"Common sandpiper, Actitis hypoleucos",15,3.53333333333333,NA,NA,0.0666666666666667,1.06666666666667,1,2,"Blomqvist et al 2002"
"Common sandpiper, Actitis hypoleucos",27,3.07407407407407,NA,NA,0.0740740740740741,1.07407407407407,1,2,"MEE et al 2004"
"Florida scrub-jay, Aphelocoma coerulescens",60,2.31666666666667,NA,NA,0,1,1,1,"Quinn et al. (1999)"
"Long-eared owl, Asio otus",12,4.91666666666667,NA,NA,0,1,1,1,"Marks et al 1999"
"Little owl, Athene noctua",16,3.3125,NA,NA,0,1,1,1,"Mller et al. (2001)"
"Tufted titmouse, Baeolophus bicolor",9,3.77777777777778,NA,NA,0.111111111111111,1.11111111111111,1,2,"Pravosudova et al 2002"
"Barnacle goose, Branta leucopsis",9,2.72,NA,NA,0,1,1,1,"Choudhury et al. (1993)"
"Barnacle goose, Branta leucopsis",63,2.17460317460317,NA,NA,0,1,1,1,"Larsson et al. (1995)"
"Red-billed buffalo weaver, Bubalornis niger",6,2.66666666666667,NA,NA,0.5,1.5,1,2,"Winterbottom et al 2001"
"Galapagos hawk, Buteo galapagoensis",10,2.2,NA,NA,0,1,1,1,"Faaborg et al. (1995)"
"Smiths longspur, Calcarius pictus",31,3.67741935483871,NA,NA,0.774193548387097,1.90322580645161,1,3,"Briskie et al. (1998)"
"Purple sandpiper, Calidris maritima",27,3.03703703703704,3,4,0.037037037037037,1.03703703703704,1,2,"Pierce & Lifjeld (1998)"
"Western sandpiper, Calidris mauri",25,2.44,NA,NA,0.08,1.08,1,2,"Blomqvist et al 2002"
"Stripe-backed wren, Campylorhynchus nuchalis",34,2.02941176470588,NA,NA,0.117647058823529,1.11764705882353,1,2,"Rabenold et al. (1990)"
"Northern cardinal, Cardinalis cardinalis",19,1.94736842105263,NA,NA,0.0526315789473684,1.05263157894737,1,2,"Ritchison et al. (1994)"
"Brown skua, Catharacta lonnbergi",26,1.73076923076923,1,2,0.0769230769230769,1.07692307692308,1,2,"Millar et al. (1994)"
"South polar skua, Catharacta maccormicki",13,1.07692307692308,1,2,0,1,1,1,"Millar et al. (1997)"
"Dusky antbird, Cercomacra tyrannina",9,1.66666666666667,NA,NA,0,1,1,1,"Fleischer et al. (1997)"
"Kentish plover, Charadrius alexandrinus",65,2.61538461538462,NA,NA,0.0153846153846154,1.01538461538462,1,2,"Blomqvist et al 2002"
"Ringed plover, Charadrius hiaticula",18,2.77777777777778,NA,NA,0,1,1,1,"Wallander et al 2001"
"Semipalmated plover, Charadrius semipalmatus",24,3.54166666666667,NA,NA,0,1,1,1,"Zharikov & Nol (2000)"
"Ross's goose, Chen rossii",24,3.45833333333333,NA,NA,0.0833333333333333,1.08333333333333,1,2,"Dunn et al. (1999)"
"Black vulture, Coragyps atratus",16,2.25,NA,NA,0,1,1,1,"Decker et al. (1993)"
"White-winged chough, Corcorax melanorhamphos",28,2.42857142857143,NA,NA,0,1,1,1,"Heinsohn et al 2000"
"Eurasian jackdaw, Corvus monedula",20,3.7,NA,NA,0,1,1,1,"Henderson et al. 2000"
"Eurasian jackdaw, Corvus monedula",15,2.6,NA,NA,0.0666666666666667,1.06666666666667,1,2,"Liebers & Peter 1998"
"Burrowing parakeet, Cyanoliseus patagonus",49,3.38775510204082,NA,NA,0,1,1,1,"Masello et al 2002"
"Laughing kookaburra, Dacelo novaeguineae",62,2.25806451612903,NA,NA,0,1,1,1,"Legge & Cockburn (2000)"
"House martin, Delichon urbicum",19,3.26315789473684,NA,NA,0.315789473684211,1.68421052631579,1,3,"Riley et al. 1995"
"Great spotted woodpecker, Dendrocopos major",36,4.47222222222222,NA,NA,0,1,1,1,"Michalek & Winkler 2001"
"Middle spotted woodpecker, Dendrocopos medius",13,4.69230769230769,NA,NA,0,1,1,1,"Michalek & Winkler 2001"
"Yellowhammer, Emberiza citrinella",32,3.84375,NA,NA,0.6875,1.75,1,3,"Sundberg & Dixon (1996)"
"Eurasian dotterel, Eudromias morinellus",22,2,1,3,0.0909090909090909,1.09090909090909,1,2,"Owens et al. (1995)"
"Fiordland penguin, Eudyptes pachyrhynchus",24,1.375,1,2,0,1,1,1,"McLean et al 2000"
"Royal penguin, Eudyptes schlegeli",13,2,2,2,0.0769230769230769,1.07692307692308,1,2,"St clair et al. (1995)"
"Merlin, Falco columbarius",18,3.33333333333333,NA,NA,0,1,1,1,"Warkentin et al. (1994)"
"Eleonoras falcon, Falco eleonorae",17,3.52941176470588,NA,NA,0,1,1,1,"Swatschek et al. (1993)"
"Lesser kestrel, Falco naumanni",26,3.34615384615385,NA,NA,0,1,1,1,"Negro et al. (1996)"
"Eurasian kestrel, Falco tinnunculus",75,4.25333333333333,3,6,0.0133333333333333,1.01333333333333,1,2,"Korpimki et al. (1996)"
"Pied flycatcher, Ficedula hypoleuca",27,5,NA,NA,0.148148148148148,1.18518518518519,1,3,"Lifjeld et al 1991"
"Tasmanian native hen, Gallinula mortierii",6,4.66666666666667,NA,NA,0,1,1,1,"Gibbs et al. (1994)"
"Common loon, Gavia immer",47,1.23404255319149,NA,NA,0,1,1,1,"Piper et al. (1997)"
"Australian magpie-lark, Grallina cyanoleuca",47,2.19148936170213,NA,NA,0.0638297872340425,1.06382978723404,1,2,"Hall & Magrath (2000)"
"Eurasian oystercatcher, Haematopus ostralegus",26,2.5,NA,NA,0.0384615384615385,1.03846153846154,1,2,"Heg et al. (1993)"
"Barn swallow, Hirundo rustica",63,4.14285714285714,NA,NA,0.333333333333333,1.33333333333333,1,2,"Mller & Tegelstrm (1997)"
"Barn swallow, Hirundo rustica",11,4.09090909090909,NA,NA,0.363636363636364,1.36363636363636,1,2,"Smith et al 1991"
"Blue duck, Hymenolaimus malacorhynchos",10,1.4,NA,NA,0,1,1,1,"Triggs et al. (1991)"
"Eurasian wryneck, Jynx torquilla",50,5.84,NA,NA,0.02,1.02,1,2,"Wink et al 2011"
"Bull-headed shrike, Lanius bucephalus",24,4.125,NA,NA,0.166666666666667,1.16666666666667,1,2,"Yamagishi et al. (1992)"
"Red-backed shrike, Lanius collurio",6,3.16666666666667,NA,NA,0.166666666666667,1.16666666666667,1,2,"Fornasari et al. (1994)"
"Lesser gray shrike, Lanius minor",36,3.77777777777778,NA,NA,0,1,1,1,"Valera et al 2003"
"Common gull, Larus canus",24,2.29166666666667,NA,NA,0.0833333333333333,1.08333333333333,1,2,"Bukacinska et al. (1998)"
"Western gull, Larus occidentalis",22,1.5,NA,NA,0,1,1,1,"Gilbert et al. (1998)"
"Palila, Loxioides bailleui",12,1.66666666666667,NA,NA,0,1,1,1,"Fleischer et al. (1994)"
"Noisy miner, Manorina melanocephala",35,2.42857142857143,NA,NA,0.0571428571428571,1.05714285714286,1,2,"Poldmaa et al. (1995)"
"Bell miner, Manorina melanophrys",13,1.84615384615385,NA,NA,0.0769230769230769,1.07692307692308,1,2,"Conrad et al. (1998)"
"Eastern screech-owl, Megascops asio",23,3.47826086956522,NA,NA,0,1,1,1,"Lawless & Ritchinson (1997)"
"Acorn woodpecker, Melanerpes formicivorus",19,2.68421052631579,NA,NA,0,1,1,1,"Dickinson et al. (1995)"
"Corn bunting, Miliaria calandra",15,2.93333333333333,NA,NA,0,1,1,1,"Hartley et al. (1993)"
"Northern wheatear, Oenanthe oenanthe",10,6.2,NA,NA,0.1,1.1,1,2,"Currie et al. (1999)"
"Northern wheatear, Oenanthe oenanthe",17,4.29411764705882,NA,NA,0.294117647058824,1.29411764705882,1,2,"Currie et al. (1998)"
"Flammulated owl, Otus flammeolus",17,2.17647058823529,NA,NA,0,1,1,1,"Arsenault et al 2002"
"Blue tit, Parus caeruleus",47,9.91489361702128,NA,NA,0.340425531914894,1.38297872340426,1,3,"Krokene et al. 1998"
"Great tit, Parus major",55,7.41818181818182,NA,NA,0.236363636363636,1.25454545454545,1,3,"Krokene et al. 1998"
"Great tit, Parus major",4,8.5,NA,NA,0.25,1.25,1,2,"Winkel et al 2001"
"Great tit, Parus major",78,8.73076923076923,NA,NA,0.397435897435897,1.3974358974359,1,2,"Strohbach et al 1998"
"Willow tit, Parus montanus",24,4.66666666666667,NA,NA,0.0416666666666667,1.04166666666667,1,2,"Orell et al. (1997)"
"House sparrow, Passer domesticus",54,3.16666666666667,NA,NA,0.037037037037037,1.03703703703704,1,2,"Veiga & Boto 2000"
"House sparrow, Passer domesticus",17,3.11764705882353,NA,NA,0.117647058823529,1.11764705882353,1,2,"Cordero et al 1999"
"New Zealand robin, Petroica australis",37,1.67567567567568,NA,NA,0,1,1,1,"Ardern et al. (1997)"
"Phainopepla, Phainopepla nitens",25,1.92,NA,NA,0,1,1,1,"Chu et al 2002"
"Red-necked phalarope, Phalaropus lobatus",63,3.58730158730159,NA,NA,0.0634920634920635,1.06349206349206,1,2,"Schamel et al 2004"
"Ruff, Philomachus pugnax",34,3,2,4,0.5,1.58823529411765,1,3,"Lank et al 2002"
"Wood warbler, Phylloscopus sibilatrix",13,4.30769230769231,NA,NA,0,1,1,1,"Gyllensten et al. (1990)"
"Willow warbler, Phylloscopus trochilus",19,6.31578947368421,NA,NA,0,1,1,1,"Gyllensten et al. (1990)"
"Red-cockaded woodpecker, Picoides borealis",44,1.81818181818182,NA,NA,0.0227272727272727,1.02272727272727,1,2,"Haig et al. (1994)"
"Eurasian three-toed woodpecker, Picoides tridactylus",23,2.08695652173913,NA,NA,0.0869565217391304,1.08695652173913,1,2,"Pechacek et al 2005"
"Takahe, Porphyrio hochstetteri",9,3,NA,NA,0,1,1,1,"Lettink et al 2002"
"Pukeko, Porphyrio porphyrio",12,6.16666666666667,5,11,1,2.08333333333333,2,3,"Jamieson et al. (1994)"
"Alpine accentor, Prunella collaris",38,2.89473684210526,NA,NA,0.5,1.55263157894737,1,3,"Hartley et al. (1995)"
"Alpine accentor, Prunella collaris",5,3.4,2,4,0.6,1.8,1,3,"Heer 1996"
"Dunnock, Prunella modularis",45,2.95555555555556,1,4,0.288888888888889,1.28888888888889,1,2,"Burke et al. (1989)"
"Bushtit, Psaltriparus minimus",10,5.9,NA,NA,0,1,1,1,"Bruce et al. (1996)"
"Adlie penguin, Pygoscelis adeliae",18,1.22222222222222,NA,NA,0.111111111111111,1.11111111111111,1,2,"Pilastro et al. (2001)"
"Chinstrap penguin, Pygoscelis antarcticus",38,2,NA,NA,0,1,1,1,"Moreno et al. (2000)"
"Canary, Serinus canaria",15,3,NA,NA,0,1,1,1,"Voigt et al 2003"
"Serin, Serinus serinus",21,2.9047619047619,NA,NA,0,1,1,1,"Mota & Hoi-Leitner 2003"
"Eastern bluebird, Sialia sialis",21,3.95238095238095,NA,NA,0.238095238095238,1.23809523809524,1,2,"Meek et al. (1994)"
"Humboldt penguin, Spheniscus humboldti",21,2.33333333333333,NA,NA,0,1,1,1,"Schwartz et al. (1999)"
"Wilson's phalarope, Steganopus tricolor",15,2.86666666666667,NA,NA,0,1,1,1,"Delehanty et al. (1998)"
"Common tern, Sterna hirundo",10,2.9,NA,NA,0,1,1,1,"Griggio et al 2004"
"Common tern, Sterna hirundo",34,3,NA,NA,0.0294117647058824,1.02941176470588,1,2,"Gonzalez-Solis et al 2001"
"Common starling, Sturnus vulgaris",14,4.42857142857143,NA,NA,0.285714285714286,1.5,1,3,"Pinxten et al 1993"
"Common starling, Sturnus vulgaris",22,4.18181818181818,NA,NA,0.318181818181818,1.31818181818182,1,2,"Smith & von Schantz (1993)"
"Nazca booby, Sula granti",21,1.52380952380952,1,2,0,1,1,1,"Anderson & Boag (2006)"
"Zebra finch, Taeniopygia guttata",25,3.28,NA,NA,0.08,1.08,1,2,"Birkhead et al. (1990)"
"Black grouse, Tetrao tetrix",11,6,NA,NA,0,1,1,1,"Alatalo et al. (1996b)"
"Carolina wren, Thryothorus ludovicianus",23,3.65217391304348,NA,NA,0,1,1,1,"Haggerty et al. (2001)"
"Monteiros hornbill, Tockus monteiri",38,3.55263157894737,NA,NA,0,1,1,1,"Stanback et al 2002"
"House wren, Troglodytes aedon",146,5.41095890410959,NA,NA,0.267123287671233,1.28082191780822,1,3,"Soukup & Thompson (1997)"
"Arabian babbler, Turdoides squamiceps",44,4.22727272727273,NA,NA,0.0909090909090909,1.09090909090909,1,2,"Lundy et al. (1998)"
"Southern lapwing, Vanellus chilensis",16,2.5625,NA,NA,0.1875,1.1875,1,2,"Saracura et al 2008"
"Blue-headed vireo, Vireo solitarius",16,2.3125,NA,NA,0.0625,1.0625,1,2,"Morton et al. (1998)"
"Capricorn silvereye, Zosterops lateralis",53,2.30188679245283,NA,NA,0,1,1,1,"Robertson et al. (2001)"
